date,content,clean,sentiment,need_help
2024-09-05,Bão Yagi sắp đổ bộ vào Việt Nam rất nguy hiểm,bão yagi sắp đổ bộ vào việt nam rất nguy hiểm,NEGATIVE,NO
2024-09-06,Nhà người dân bị ngập sâu cần cứu trợ gấp,nhà người dân bị ngập sâu cần cứu trợ gấp,NEGATIVE,YES
2024-09-07,Chính quyền và người dân hỗ trợ rất nhanh và hiệu quả,chính quyền và người dân hỗ trợ rất nhanh và hiệu quả,NEGATIVE,NO
2024-09-08,Trong nhà thiếu nước sạch và thức ăn,trong nhà thiếu nước sạch và thức ăn,NEGATIVE,NO
2024-09-09,Mọi người đang hỗ trợ giúp đỡ lẫn nhau,mọi người đang hỗ trợ giúp đỡ lẫn nhau,NEGATIVE,NO
2024-09-10,Người dân cần hỗ trợ y tế khẩn cấp,người dân cần hỗ trợ y tế khẩn cấp,NEGATIVE,YES
